{"nodes": [{"id": "Anca Alexandrescu", "type": "Person", "properties": {}}, {"id": "Dan Andronic", "type": "Person", "properties": {}}, {"id": "Ovidiu \u0218incai", "type": "Person", "properties": {}}, {"id": "Nicolae Ceau\u0219escu", "type": "Person", "properties": {}}, {"id": "Partidul Comunist Rom\u00e2n", "type": "Political party", "properties": {}}, {"id": "General Biri\u0219", "type": "Person", "properties": {}}, {"id": "Sorin Ro\u0219ca St\u0103nescu", "type": "Person", "properties": {}}, {"id": "George P\u0103unescu", "type": "Person", "properties": {"occupation": "colonel de securitate"}}, {"id": "Bobby P\u0103unescu", "type": "Person", "properties": {}}, {"id": "Aur", "type": "Political party", "properties": {}}, {"id": "Caraman", "type": "Person", "properties": {}}, {"id": "Roman", "type": "Person", "properties": {}}, {"id": "Colonel Neme\u021bi", "type": "Person", "properties": {}}, {"id": "Georgescu", "type": "Person", "properties": {}}, {"id": "Mircea Geoan\u0103", "type": "Person", "properties": {}}, {"id": "Hillary Clinton", "type": "Person", "properties": {}}, {"id": "Agen\u021bia De Monitorizare A Presei Monitoring Media", "type": "Organization", "properties": {}}, {"id": "Bancorex", "type": "Company", "properties": {}}, {"id": "Constantinescu", "type": "Person", "properties": {}}, {"id": "Adrian N\u0103stase", "type": "Person", "properties": {}}, {"id": "Dana N\u0103stase", "type": "Person", "properties": {}}, {"id": "Abis Media Srl", "type": "Company", "properties": {}}, {"id": "Psd", "type": "Political party", "properties": {}}, {"id": "Sorin Oprescu", "type": "Person", "properties": {"conviction": "constituirea unui grup infrac\u021bional organizat \u00een varianta agravat\u0103, luare de mit\u0103, abuz \u00een serviciu \u0219i sp\u0103lare de bani", "sentence": "10 ani \u0219i opt luni de \u00eenchisoare"}}, {"id": "Adrian Di\u021b\u0103", "type": "Person", "properties": {}}, {"id": "Dragnea", "type": "Person", "properties": {}}, {"id": "Ancom", "type": "Government body", "properties": {}}, {"id": "Transgaz", "type": "Company", "properties": {}}, {"id": "Vodafone", "type": "Company", "properties": {}}, {"id": "Pink Foods International Srl", "type": "Company", "properties": {}}, {"id": "Fondul Rom\u00e2n De Contragarantare", "type": "Organization", "properties": {}}, {"id": "Romaero", "type": "Company", "properties": {}}, {"id": "Romarm", "type": "Company", "properties": {}}, {"id": "Ior", "type": "Company", "properties": {}}, {"id": "Iliescu", "type": "Person", "properties": {}}, {"id": "Gu\u0219\u0103", "type": "Person", "properties": {}}, {"id": "Realitatea Tv", "type": "Company", "properties": {}}, {"id": "Serviciul Extern De Informa\u021bii", "type": "Government body", "properties": {}}, {"id": "Pdsr", "type": "Political party", "properties": {}}], "relationships": [{"source": {"id": "Anca Alexandrescu", "type": "Person", "properties": {}}, "target": {"id": "Dan Andronic", "type": "Person", "properties": {}}, "type": "SPOUSE", "properties": {}}, {"source": {"id": "Anca Alexandrescu", "type": "Person", "properties": {}}, "target": {"id": "Pdsr", "type": "Political party", "properties": {}}, "type": "MEMBER_OF", "properties": {"end_date": "1996-08-01"}}, {"source": {"id": "Ovidiu \u0218incai", "type": "Person", "properties": {}}, "target": {"id": "Anca Alexandrescu", "type": "Person", "properties": {}}, "type": "BOSS_OF", "properties": {"context": "echipa de campanie a partidului", "year": "1996"}}, {"source": {"id": "Ovidiu \u0218incai", "type": "Person", "properties": {}}, "target": {"id": "Nicolae Ceau\u0219escu", "type": "Person", "properties": {}}, "type": "SUPPORTER_OF", "properties": {}}, {"source": {"id": "Anca Alexandrescu", "type": "Person", "properties": {}}, "target": {"id": "Sorin Ro\u0219ca St\u0103nescu", "type": "Person", "properties": {}}, "type": "ASSOCIATE_OF", "properties": {}}, {"source": {"id": "George P\u0103unescu", "type": "Person", "properties": {}}, "target": {"id": "Anca Alexandrescu", "type": "Person", "properties": {}}, "type": "GODFATHER_OF", "properties": {}}, {"source": {"id": "George P\u0103unescu", "type": "Person", "properties": {}}, "target": {"id": "Bobby P\u0103unescu", "type": "Person", "properties": {}}, "type": "FATHER_OF", "properties": {}}, {"source": {"id": "Bobby P\u0103unescu", "type": "Person", "properties": {}}, "target": {"id": "Aur", "type": "Political party", "properties": {}}, "type": "SUPPORTER_OF", "properties": {}}, {"source": {"id": "Caraman", "type": "Person", "properties": {}}, "target": {"id": "Serviciul Extern De Informa\u021bii", "type": "Government body", "properties": {}}, "type": "CHIEF_OF", "properties": {}}, {"source": {"id": "Anca Alexandrescu", "type": "Person", "properties": {}}, "target": {"id": "Serviciul Extern De Informa\u021bii", "type": "Government body", "properties": {}}, "type": "RECRUITED_BY", "properties": {"source": "Colonel Neme\u021bi"}}, {"source": {"id": "Dan Andronic", "type": "Person", "properties": {}}, "target": {"id": "Serviciul Extern De Informa\u021bii", "type": "Government body", "properties": {}}, "type": "RECRUITED_BY", "properties": {"source": "Colonel Neme\u021bi"}}, {"source": {"id": "Georgescu", "type": "Person", "properties": {}}, "target": {"id": "Mircea Geoan\u0103", "type": "Person", "properties": {}}, "type": "ADVISOR_TO", "properties": {}}, {"source": {"id": "Anca Alexandrescu", "type": "Person", "properties": {}}, "target": {"id": "Agen\u021bia De Monitorizare A Presei Monitoring Media", "type": "Organization", "properties": {}}, "type": "FOUNDER_OF", "properties": {"year": "1997"}}, {"source": {"id": "Anca Alexandrescu", "type": "Person", "properties": {}}, "target": {"id": "Ziar", "type": "Organization", "properties": {}}, "type": "EDITOR_AT", "properties": {"year": "1997"}}, {"source": {"id": "Agen\u021bia De Monitorizare A Presei Monitoring Media", "type": "Organization", "properties": {}}, "target": {"id": "Bancorex", "type": "Company", "properties": {}}, "type": "ADVERTISED", "properties": {}}, {"source": {"id": "George P\u0103unescu", "type": "Person", "properties": {}}, "target": {"id": "Bancorex", "type": "Company", "properties": {}}, "type": "INVOLVED_IN_BANKRUPTCY_OF", "properties": {}}, {"source": {"id": "Adrian N\u0103stase", "type": "Person", "properties": {}}, "target": {"id": "Anca Alexandrescu", "type": "Person", "properties": {}}, "type": "SUPERIOR_OF", "properties": {}}, {"source": {"id": "Anca Alexandrescu", "type": "Person", "properties": {}}, "target": {"id": "Abis Media Srl", "type": "Company", "properties": {}}, "type": "FOUNDER_OF", "properties": {"year": "2004"}}, {"source": {"id": "Anca Alexandrescu", "type": "Person", "properties": {}}, "target": {"id": "Sorin Oprescu", "type": "Person", "properties": {}}, "type": "ASSOCIATE_OF", "properties": {}}, {"source": {"id": "Anca Alexandrescu", "type": "Person", "properties": {}}, "target": {"id": "Adrian Di\u021b\u0103", "type": "Person", "properties": {}}, "type": "SPOUSE", "properties": {}}, {"source": {"id": "Adrian Di\u021b\u0103", "type": "Person", "properties": {}}, "target": {"id": "Ancom", "type": "Government body", "properties": {}}, "type": "CHIEF_OF", "properties": {}}, {"source": {"id": "Adrian Di\u021b\u0103", "type": "Person", "properties": {}}, "target": {"id": "Transgaz", "type": "Company", "properties": {}}, "type": "EMPLOYEE_OF", "properties": {}}, {"source": {"id": "Adrian Di\u021b\u0103", "type": "Person", "properties": {}}, "target": {"id": "Vodafone", "type": "Company", "properties": {}}, "type": "EMPLOYEE_OF", "properties": {}}, {"source": {"id": "Anca Alexandrescu", "type": "Person", "properties": {}}, "target": {"id": "Dragnea", "type": "Person", "properties": {}}, "type": "RIGHT_HAND_OF", "properties": {}}, {"source": {"id": "Anca Alexandrescu", "type": "Person", "properties": {}}, "target": {"id": "Pink Foods International Srl", "type": "Company", "properties": {}}, "type": "SOLD_PROPERTY_TO", "properties": {"property": "Aproape 9 ha", "price": "80000 \u20ac \u0219i un Touareg"}}, {"source": {"id": "Anca Alexandrescu", "type": "Person", "properties": {}}, "target": {"id": "Fondul Rom\u00e2n De Contragarantare", "type": "Organization", "properties": {}}, "type": "EMPLOYEE_OF", "properties": {}}, {"source": {"id": "Anca Alexandrescu", "type": "Person", "properties": {}}, "target": {"id": "Romaero", "type": "Company", "properties": {}}, "type": "EMPLOYEE_OF", "properties": {}}, {"source": {"id": "Anca Alexandrescu", "type": "Person", "properties": {}}, "target": {"id": "Romarm", "type": "Company", "properties": {}}, "type": "EMPLOYEE_OF", "properties": {}}, {"source": {"id": "Anca Alexandrescu", "type": "Person", "properties": {}}, "target": {"id": "Ior", "type": "Company", "properties": {}}, "type": "EMPLOYEE_OF", "properties": {}}, {"source": {"id": "Gu\u0219\u0103", "type": "Person", "properties": {}}, "target": {"id": "Psd", "type": "Political party", "properties": {}}, "type": "SECRETARY_GENERAL_OF", "properties": {}}], "source": {"id": null, "metadata": {}, "page_content": "Transcript of: Anca \u201cMars\u0326\u201d Alexandrescu. Portavocea primului sonat al t\u0326a\u0306rii. Partea a 2-a \uff5c Starea Impostorilor #88.mp3\n==================================================\n\nEpisodul de azi este despre fulminanta carier\u0103 a doamnei Alexandrescu dup\u0103 1996. Trez la starea impostorilor cu mine, Valeriu Nicolae. Dac\u0103 nu a\u021bi v\u0103zut episodul precedent, ar fi util s\u0103-l vede\u021bi pentru a \u00een\u021belege mai bine cum copiii securi\u0219tilor no\u0219tri au devenit jurnali\u0219tii copiilor no\u0219tri. \u00cen august 1996, Anca Alexandrescu demisiona din toate pozi\u021biile din PDSR. N\u0103stase nu a vrut s\u0103 o pun\u0103 pe listele de la parlamentare. Nu, nu a r\u0103mas pe drumuri, Doamne fere\u0219te. Nu, nu. \u00cen 1996 a fost \u00een echipa de campanie a partidului. \u0218eful ei era Ovidiu \u0218incai. Ovidiu \u0218incai. \u0218i el un foarte abil pupincurist al lui Ceau\u0219escu. Asigur\u00e2ndu-ne unirea for\u021belor \u00eentregii na\u021biuni \u00een \u00eenf\u0103ptuirea obiectivelor Congresului al XIII-lea al Partidului Comunist Rom\u00e2n, secretarul s\u0103u general, tovar\u0103\u0219ul Nicolae Ceau\u0219escu, a \u00eentreprins \u00een repetate r\u00e2nduri analize profunde asupra modului \u00een care se aplic\u0103 hot\u0103r\u00e2rile de partid \u0219i legile \u021b\u0103rii, a comb\u0103tut permanent lipsurile \u0219i st\u0103rile de lucruri negative. Totu\u0219i, cine era Anca Alexandrescu \u00een 1996? Era so\u021bia lui Dan Andronic, nepotul unui securist \u0219i m\u00e2na dreapt\u0103 pe vremurile alea a \u0219efului Serviciului Extern de Informa\u021bii, un om extrem de influent, generalul de brigad\u0103 colonel Biri\u0219. Mai trecuse \u0219i prin dou\u0103 ziare conduse de Sorin Ro\u0219ca St\u0103nescu, \u0219i el pu\u0219c\u0103ria\u0219 \u0219i turn\u0103tor la securitate, om de care a fost foarte apropiat\u0103. O Nedi Hanie care o promoveaz\u0103 \u0219i acum la greu. Pe zi ce trece, \u00eemi dau seama c\u0103 jurnalista \u0103\u0103 Anca Alexandrescu \u0103\u0103 a devenit \u0103\u0103 unul dintre cei mai mari \u0103\u0103 exper\u021bi \u00een anchete, \u00een anchetele de mare r\u0103sunet \u0219i este \u0103\u0103 \u00een aceast\u0103 postur\u0103 aproape un magician. Se lupt\u0103 \u0103\u0103 cu toat\u0103 \u0219erp\u0103ria \u0103\u0103 Coldea, cu o d\u00e2rzenie \u0103\u0103 neobi\u0219nuit\u0103 \u0103\u0103 \u0219i mai nou \u0103\u0103 se bate \u0219i cu v\u00e2rful de atac al acestei \u0219erp\u0103rii care este \u0103\u0103 avocatul Tr\u0103il\u0103, avocatul statului subteran. Ro\u0219ca St\u0103nescu a fost prezentat ca un \u0219antajist sinistru, condamnat la doi ani \u0219i patru luni de \u00eenchisoare cu executare pentru utilizarea informa\u021biei privilegiate \u0219i pentru aderare sau sprijinire sub orice form\u0103 a unui grup infrac\u021bional organizat. Ro\u0219ca St\u0103nescu, un om foarte apropiat de fo\u0219tii securi\u0219ti din serviciile secrete, cu ni\u0219te afaceri \u00een domeniul securit\u0103\u021bii de o dubio\u0219enie sc\u00e2rbavnic\u0103. Na\u0219ul de c\u0103s\u0103torie al Anc\u0103i Alexandrescu era nimeni altul dec\u00e2t George P\u0103unescu, fost colonel de securitate, cel care ne-a dat o \u021beap\u0103 de 169 de milioane de dolari, care \u00eensemnau un minim de 11200 de apartamente cu dou\u0103 camere, adic\u0103 mai clar 700 de blocuri pe vremea aia. Fiul lui, Bobby P\u0103unescu, este \u0219i patron de televiziune \u0219i unul dintre oamenii din spatele AUR. \u0218i cumva Anca Alexandrescu este mare, mare lupt\u0103toare \u00eempotriva sistemului paralel? Hai s\u0103 vedem un interviu cu unul dintre cei mai toxici oameni ai securit\u0103\u021bii. Voiam s\u0103 v\u0103 \u00eentreb ceva. Pe acest scenariu a ajuns Caraman \u0219ef la Serviciul Rom\u00e2n de Informa\u021bii Externe, pentru c\u0103 s-a spus de foarte multe ori: \u201eCum a ajuns Caraman sau cum ne doream noi s\u0103 intr\u0103m \u00een NATO at\u00e2ta timp c\u00e2t un om din serviciile secrete care a fost decorat de KGB a fost pus \u0219ef la SIE?\u201d Pot s\u0103 v\u0103 spun deschis aici c\u0103 eu am avut discu\u021bii cu Caraman care categoric \u00eel sus\u021binea pe Roman. \u0218i nu numai c\u0103-l sus\u021binea pe Roman. Voia s\u0103 m\u0103 fac\u0103 \u0219i pe mine s\u0103-l sus\u021bin pe Roman. Ei bine, cine-l pupa \u00een dos la ziar \u00een 1993 pe domnul Roman? Anca Alexandrescu. Faptul c\u0103 sunt oameni care cred c\u0103 Alexandreasca este orice altceva dec\u00e2t o trompet\u0103 a unor fo\u0219ti securi\u0219ti \u0219i mafio\u021bi care se lupt\u0103 s\u0103 c\u00e2\u0219tige puterea de la al\u021bi securi\u0219ti \u0219i mafio\u021bi e o dovad\u0103 de maxim\u0103 inocen\u021b\u0103, ca s\u0103 nu zic prostie. Nu numai asta, dar \u00eentr-o carte a unui fost spion, colonel Neme\u021bi, acesta scrie c\u0103 Alexandreasca a fost la fel ca \u0219i so\u021bul ei, Dan Andronic, recrutat\u0103 de SIE. S\u0103 nu uit\u0103m c\u0103 Georgescu a fost acuzat \u0219i el c\u0103 ar fi fost din re\u021beaua Caraman, adic\u0103 SIE. La fel \u0219i Geoan\u0103, pentru care Georgescu a fost consilier onorific. Hai s\u0103 vedem ce zicea Anca Alexandrescu despre Geoan\u0103 atunci c\u00e2nd era \u00een tab\u0103ra advers\u0103 din PSD. Toat\u0103 lumea l-a sprijinit pe Mircea Geoan\u0103. \u0218i tot n-a ie\u0219it pre\u0219edinte. Crezi \u0219i-n sprijin de la Washington pentru Mircea Geoan\u0103, sprijin de la Moscova? Nu, nu. \u0102\u0103, a, de la Moscova nu \u0219tiu, poate. De la Washington nu. Sunt informa\u021bii de foarte mult\u0103 vreme c\u0103 Mircea Geoan\u0103 nu mai are acel sprijin cu care se l\u0103uda de la Washington. \u0102\u0103, \u0219tiu c\u0103 la un moment dat \u0103\u0103 a \u00eencercat s\u0103 transmit\u0103 prin pres\u0103, prin diver\u0219i oameni ai lui c\u0103 va fi sprijinit \u00een campania electoral\u0103 de Hillary Clinton. Eu n-am v\u0103zut-o la Bucure\u0219ti s\u0103 vin\u0103 s\u0103-l sus\u021bin\u0103. Nu i-a\u0219 acuza pe \u0103\u0103 cei de la Moscova c\u0103 l-au sus\u021binut pe Mircea Geoan\u0103. Mai degrab\u0103 l-a\u0219 acuza pe Mircea Geoan\u0103 c\u0103 s-a dus de dou\u0103 sau de trei ori la Moscova. Nu \u0219tiu care au fost inten\u021biile lui \u0219i nu cred c\u0103 un diplomat de carier\u0103 trebuie s\u0103 procedeze a\u0219a. \u00cen 1997, doamna Alexandrescu, conform CV-ului, devine \u0219i redactor la ziar \u0219i pre\u0219edinte fondator la Agen\u021bia de Monitorizare a Presei Monitoring Media. Monitoring Media semna articole \u00een ziarul condus de tat\u0103l domniei sale, \u00een care se f\u0103cea reclam\u0103 la Bancorex, banca aia devalizat\u0103 de na\u0219ul doamnei Alexandrescu, George P\u0103unescu. Mai clar, Alexandreasca, \u00een timp ce scria la un ziar chipurile concurent, era pre\u0219edinta unei organiza\u021bii care semna articole exclusiv la ziarul condus de Ro\u0219ca St\u0103nescu. Nu numai asta, dar s\u0103 vezi minune de minune, organiza\u021bia doamnei Alexandrescu prime\u0219te un apartament de la statul nostru cel minunat la ni\u0219te pre\u021buri de \u00eenchiriere cam de 100 de ori mai mici dec\u00e2t pre\u021bul pie\u021bei de pe atunci. Dar nu, m\u0103, nu. Doamna Alexandrescu nu era din sistem, Doamne fere\u0219te. La ziar continu\u0103 s\u0103 fie trimis\u0103 la vizitele \u00een str\u0103in\u0103tate ale pre\u0219edintelui. Din nou. Doamne, Doamne, cum s\u0103 fi fost Alexandreasca informatoare a SIE? Nu, nu. Ea a fost tot timpul pe meritocra\u021bie, nu v\u0103 da\u021bi voi seama. \u00cen 2000, doamna Alexandrescu participa la vizita la New York a domnului Constantinescu, unde acesta s-a \u00eent\u00e2lnit cu Soro\u0219 \u0219i nici atunci nimic, m\u0103, nimic r\u0103u despre Soro\u0219. Imediat ce c\u00e2\u0219tig\u0103 PSD-ul \u0219i Adrian N\u0103stase devine \u0219eful guvernului, ziua, ziarul condus de Horia Ro\u0219ca St\u0103nescu, unde Alexandreasca lucra, devine imediat sl\u0103vitorul domnului N\u0103stase \u0219i, desigur, cei doi \u00eel \u00eenso\u021besc pe bani publici \u00een vizitele acestuia prin lume. Aici dovezi din 2001 \u0219i 2002. Deontologic, m\u0103, deontologic, cum se face. Titluri care de care mai slugarnice, c\u0103 doar banii veneau de la partid, nu din scris. Alexandreasca l-a lins atent \u0219i pe Dana N\u0103stase, so\u021bia lui N\u0103stase, fiica uneia dintre cei mai importan\u021bi mini\u0219tri comuni\u0219ti. Asta \u00een timp ce-l prezenta pe so\u021bul ei ca eroul na\u021biunii. Pe N\u0103stase \u0219i-a exersat doamna talentele pe care le vedem acum \u00een promovarea lui Georgescu. Care Georgescu? \u0102sta de aici. Mintea iar\u0103\u0219i trebuie s\u0103 moar\u0103 ca s\u0103 existe libertate. Este singura \u0219ans\u0103. \u0218i nu poate s\u0103 se \u00eent\u00e2mple acest lucru dec\u00e2t \u00een momentul \u00een care oamenii trebuie s\u0103 \u00een\u021beleag\u0103 c\u0103 ei nu sunt s\u0103raci. Sunt doar naivi. Mintea trebuie s\u0103 moar\u0103 ca s\u0103 existe libertate. Este singura \u0219ans\u0103. Oamenii nu sunt s\u0103raci, sunt doar naivi. B\u0103, nu \u0219tiam eu de ce Georgescu d\u0103 pe dinafar\u0103 cu idio\u021benii. Acum e clar. Scopul lui e s\u0103 ne omoare mintea cu t\u00e2mpeniile lui. Bun, e clar c\u0103 \u0219arlatanul \u0103sta, ca \u0219i Alexandreasca, \u0219tiu c\u0103 oamenii sunt naivi \u0219i uituci, c\u0103 altfel ei ar fi ni\u0219te nimeni \u0219i nu speran\u021ba a milioane. Dar hai s\u0103 ne uit\u0103m un pic \u0219i la firmele doamnei Alexandrescu, c\u0103ci \u00een 2004 devine iar\u0103\u0219i m\u00e2na dreapt\u0103 a lui N\u0103stase. Abis Media SRL e prima ei firm\u0103. Pe bune, Alexandreasca \u00eenfiin\u021beaz\u0103 \u00een 2004, \u00een momentul \u00een care este consiliera PSD, firma asta, Abis Media. Pe m\u0103sur\u0103 ce N\u0103stase \u00ee\u0219i pierde influen\u021ba \u00een PSD, firma doamnei Alexandrescu se duce \u00een cap, c\u0103 doar banii, cum v\u0103 spuneam, vin de la partid, nu de unde, de altundeva. \u00cen perioada \u00een care Alexandreasca \u00eel atac\u0103 deschis pe Geoan\u0103, \u0219eful de-atunci al PSD, situa\u021bia evident devine chiar dramatic\u0103. \u00cen 2009, firma are de departe cele mai slabe \u00eencas\u0103ri \u0219i se duce pe minus. Alexandreasca are nevoie s\u0103 ling\u0103 alt dos, a\u0219a c\u0103 trece rapid la Oprescu. Oprescu, fiu de fost general de securitate, un \u0219p\u0103gar infect, care a fost f\u0103cut sc\u0103pat de securi\u0219tii vechi din servicii. \u0218tie doamna Alexandrescu care. \u00cen momentul \u00een care se mut\u0103 la Oprescu, afacerile Abis Media cresc cu, m\u0103, v\u0103 \u021bine\u021bi bine, cu 2100% \u00een primul an \u0219i apoi cu 2900% al doilea an. 2009 a fost cel mai prost an \u0219i pentru alt\u0103 firm\u0103 a doamnei Alexandrescu. Dar hai s\u0103 v\u0103 d\u0103m o pauz\u0103 cu sonat, cu sunat. Hristos este singurul care poate s\u0103 reprezinte \u0219tiin\u021ba. \u0218tiin\u021ba \u00een esen\u021b\u0103 este Iisus Hristos. Nu ai cum s\u0103 ai alt\u0103 \u0219tiin\u021b\u0103, pentru c\u0103 tu nu ai fost \u00een stare ca om s\u0103 creezi nimic viu. Ci ai distrus viu. Deci \u0103sta e profesor universitar. \u0218i zice c\u0103 singurul care poate reprezenta \u0219tiin\u021ba e Iisus Hristos? Cum? Nu am fost \u00een stare s\u0103 cre\u0103m nimic viu? Nebunule, copiii t\u0103i nu sunt vii? Cum adic\u0103 nu cre\u0103m nimic viu? C\u0103 doar de asta exist\u0103m, c\u0103 p\u0103rin\u021bii no\u0219tri au creat ceva viu. Sau tu crezi c\u0103 suntem ma\u0219ini? Sau cum? \u00cen 2009, Alexandreasca, cum v\u0103 spuneam, era \u00eempotriva lui Geoan\u0103, sup\u0103rat\u0103 foc c\u0103 acesta era \u00eempotriva lui N\u0103stase \u0219i Rebeenciuc. Doamna Alexandrescu a fost, cum v-am ar\u0103tat \u00een primul episod, o foarte apropiat\u0103 a lui Rebeenciuc. Mare, mare cinstit \u0219i \u0103la. Nicio problem\u0103, \u00eens\u0103, c\u0103ci cercurile securit\u0103\u021bii sunt largi, a\u0219a cum v-am ar\u0103tat \u0219i se angajeaz\u0103 la fiul fostului general de securitate Oprescu. Care Oprescu? Doctorul Sorin Oprescu a primit patru condamn\u0103ri pentru tot at\u00e2tea acuza\u021bii de corup\u021bie: constituirea unui grup infrac\u021bional organizat \u00een varianta agravat\u0103, luare de mit\u0103, abuz \u00een serviciu \u0219i sp\u0103lare de bani. Dup\u0103 contopire, doi dintre cei trei membri ai completului de judecat\u0103 i-au dat pedeapsa de 10 ani \u0219i opt luni de \u00eenchisoare, \u00eens\u0103 poli\u021bi\u0219tii nu l-au g\u0103sit acas\u0103. Ei, nu este prima dat\u0103. \u00cen 1998, \u00een timp ce lucra pentru liberalul turn\u0103tor la securitate \u0219i viitor pu\u0219c\u0103ria\u0219 Ro\u0219ca St\u0103nescu, Alexandreasca \u00eei f\u0103cea campanie lui Oprescu, care era pe-atunci \u00een PDSR. Despre plimb\u0103rile Anc\u0103i Alexandrescu pe foarte mul\u021bi bani publici \u00een perioada Oprescu s-a scris la greu. Da, da. Alexandreasca se ducea la hoteluri de cinci stele pe bani publici, c\u0103 doar asta e defini\u021bia sociopatiei. Cu renumitul domn Pieleanu. Of! Pieleanu, m\u0103, \u0103la de la Antene \u0219i cu fetele. Pe-atunci, Oprescu o promova la greu s\u0103 fie pe listele USL-ului. \u0218i Oprescu a participat la competi\u021bia pentru Cotroceni, c\u0103 doar era fiu de securist \u0219i ho\u021b, deci aproape perfect pentru Alexandreasca \u0219i PSD. Adrian Di\u021b\u0103 a fost \u0219i el so\u021bul doamnei Alexandrescu. Putem groaz\u0103-n securitate din aia, SIE, cu \u0219coala militar\u0103 \u0219i Colegiul Na\u021bional de Ap\u0103rare, de\u0219i omul \u00een acte nu avea nicio treab\u0103 nici cu politica \u0219i nici cu ap\u0103rarea, c\u0103ci lucra la Vodafone. A fost numit \u00een perioada lui Dragnea, c\u00e2nd Alexandreasca t\u0103ia \u0219i sp\u00e2nzura, \u0219ef la ANCOM, alt\u0103 chestie plin\u0103 de acoperi\u021bi \u0219i acum e la Transgaz. CV-ul domnului Di\u021b\u0103 e de o puturo\u0219enie absolut\u0103. \u00cen anii \u00een care Alexandreasca nu a mai avut sus\u021binerea PSD, omul a fost timp de trei ani \u00een \u0219omaj. Trei ani pe bar\u0103, c\u0103ci a\u0219a func\u021bioneaz\u0103 trompetele. \u00cen 2011, omul, dac\u0103 e s\u0103 ne lu\u0103m dup\u0103 declara\u021bia de avere a doamnei Alexandrescu, a c\u00e2\u0219tigat mai pu\u021bin de 100 RON pe lun\u0103. Sub 25 \u20ac pe lun\u0103 c\u00e2\u0219tiga so\u021bul Anc\u0103i Alexandrescu \u00een 2011. Om care a ajuns s\u0103 c\u00e2\u0219tige cu mult peste 100000 \u20ac pe an din sinecuri de la stat \u00een perioada \u00een care Alexandreasca era m\u00e2na dreapt\u0103 a domnului Dragnea. B\u0103i, ei, sigur, era pe meritocra\u021bie, pe meritocra\u021bie. Declara\u021biile de avere ale doamnei sunt \u0219i ele ni\u0219te mizerii. \u00cen 2012, Alexandreasca avea pe numele ei trei apartamente. Mai era un apartament \u0219i pe numele so\u021bului. \u00cen 2013, apare c\u0103 doamna Alexandrescu mai are \u00een proprietate doar un singur apartament. Unul de 4,16 m\u00b2. La fel apare \u0219i \u00een 2014 \u0219i apoi p\u00e2n\u0103 \u00een 2019. Mai clar, dac\u0103 ar fi s\u0103 o credem pe Anca Alexandrescu, ea a tr\u0103it cu doi copii \u00eentr-o debara de 4 m\u00b2 din 2013 p\u00e2n\u0103 \u00een 2019. Of, s\u0103r\u0103chie, s\u0103r\u0103chie, s-a sacrificat pentru \u021bar\u0103, c\u0103 doar nu crede\u021bi c\u0103 deontoloaga Alexandreasca a f\u0103cut fals \u00een acte publice de cel pu\u021bin cinci ori. \u00cenc\u0103 o pauz\u0103 de sonat, de sunat, m\u0103 scuza\u021bi, de sunat. A\u0219a este vorba-n popor. Zice: \u201eS\u0103 vezi \u0219i s\u0103 crezi.\u201d Nu. S\u0103 crezi \u0219i s\u0103 vezi. \u0218i dac\u0103 \u00eentr-o \u021bar\u0103 ca Rom\u00e2nia, cu un trecut imens istoric, acest lucru se va releva, este exact ceea ce i-a fost h\u0103r\u0103zit acestei \u021b\u0103ri, s\u0103 salveze o \u00eentreag\u0103 omenire. \u0218i momentul \u00een care va ap\u0103rea \u0219i va ap\u0103rea sigur o fiin\u021b\u0103 de lumin\u0103 \u00een Rom\u00e2nia, care s\u0103 demonstreze \u00een Rom\u00e2nia acest lucru, dincolo de ceea ce facem noi, eu, dumneavoastr\u0103 \u0219i al\u021bii. Este printre noi? Atunci oamenii vor spune nu am crezut \u0219i acuma v\u0103d. Cine, cine s\u0103 fie fiin\u021ba aia de lumin\u0103, oare? Cine? Eu cred c\u0103 Alexandreasca ne salveaz\u0103, b\u0103i. Ea e cu istoria imens\u0103 a poporului. Of! Ea vrea s\u0103 crede\u021bi. Ea vrea s\u0103 ne trezeasc\u0103 cu eroismul ei imens la televiziunea aia unde linge la comand\u0103. Mie \u00eens\u0103 mi-a pl\u0103cut aia cu \u0219ocurile. Georgescu, nesonatul Georgescu vorbe\u0219te despre cum lumea se treze\u0219te cu \u0219ocuri. Ei bine, hai s\u0103 v\u0103 ajut\u0103m noi cu un mic \u0219oc, c\u0103 poate mai trezim pe unul dintre hipnotiza\u021bii de Alexandreasca. Ultima ei declara\u021bie de avere ar fi trebuit, conform legii, s\u0103 includ\u0103 to\u021bi banii pe care doamna Anca Alexandrescu i-a f\u0103cut \u00een 2018. Ei bine, asta apare \u00een declara\u021bia ei de avere. Obligatoriu ar fi trebuit s\u0103 treac\u0103 din nou to\u021bi banii primi\u021bi \u00een 2018. Ea trece \u0219mechere\u0219te doar venitul lunar, 5700 RON, de\u0219i la sf\u00e2r\u0219itul anului era de 5981 RON pe lun\u0103. Adic\u0103 se d\u0103dea fat\u0103 s\u0103rac\u0103 \u0219i cinstit\u0103, min\u021bind un pic. \u00cen fapt o s\u0103 v\u0103 ar\u0103t\u0103m c\u0103 min\u021bea \u00eengrozitor. A trecut \u0219i dividendele de la Abis Media, 58000 \u0219i cei 30000 primi\u021bi din pensie alimentar\u0103. Cum a primit doamna Alexandrescu dividende de la Abis Media c\u00e2nd firma a raportat pe 2018 zero venituri \u0219i zero angaja\u021bi, iar \u00een 2017 terminase anul cu o gaur\u0103 de peste 70000 RON \u00een buget? Minune, minune, cum s-ar zice. S-a rugat sigur pentru popor \u0219i uite a\u0219a s-a l\u0103sat cu un miracol \u00een conturile ei. Nu e tot. \u00cen acela\u0219i timp, doamna Alexandrescu mai avea \u00eenc\u0103 dou\u0103 sinecuri. Una la Fondul Rom\u00e2n de Contragarantare, unde avea experien\u021b\u0103 absolut zero zero \u0219i la Romaero, unde singura experien\u021b\u0103 ar fi putut fi de, scuze, nu are nici pentru sinecura asta niciun fel de experiment, de experien\u021b\u0103. Ei bine, apar sinecurile astea, dar \u0219i ele bine ascunse \u00een declara\u021bia de interese. Problema e c\u0103 doamna Alexandrescu minte cu nesim\u021birea ei tipic\u0103. Trece ca \u0219i cum din mai 2018 p\u00e2n\u0103 la sf\u00e2r\u0219itul lui septembrie 2019 ar fi c\u00e2\u0219tigat doar 7200 RON de la Contragarantare \u0219i din martie 2019 p\u00e2n\u0103 pe 27 septembrie 2500 RON de la Romaero. Ambele sunt de fapt cifrele pe lun\u0103, adic\u0103 de mai mult de 10 ori mai pu\u021bin \u0219i sunt un pic mai mari cifrele pe lun\u0103. Mai clar, \u00een 2019, doamna Alexandrescu f\u0103cea pe lun\u0103 net peste 16000 RON de la stat, adic\u0103 cu aproape 300% mai mult dec\u00e2t declara, adic\u0103 mult mai mult dec\u00e2t c\u00e2\u0219tiga pre\u0219edintele Rom\u00e2niei. Ei, dar nici Georgescu nu are cum s\u0103 justifice banii pe care i-a f\u0103cut. Acesta este cel mai important lucru. Adic\u0103 tu trebuie s\u0103 reu\u0219e\u0219ti s\u0103 tr\u0103ie\u0219ti \u00een afara cauzei \u0219i a efectului. Adic\u0103 \u00een stare de non-minte. \u0218i atunci po\u021bi s\u0103 \u00een\u021belegi divinul. Asta este proiectul de \u021bar\u0103 Hran\u0103 pe Energie, care nu este doar o ni\u0219\u0103 economic\u0103, care poate ridica \u021bara rom\u00e2neasc\u0103 \u00een foarte scurt timp pe cel mai \u00eenalt nivel economic din Europa, cel pu\u021bin. Of! Cum nu pricepem noi c\u0103 omul a tr\u0103it \u00een afara cauzei \u0219i a efectului? El a f\u0103cut banii fiind \u00een stare de non-minte \u0219i a \u00een\u021beles divinul, b\u0103, pro\u0219tilor, care cere s\u0103 v\u0103 explice de unde a avut poala aia de bani pentru vile \u0219i toate videourile alea de promovare. Ce conteaz\u0103? E c\u0103 proiectul lui de non-minte ne va duce \u00een foarte scurt timp economic la cel mai \u00eenalt nivel din Europa, cel pu\u021bin. Ura! Ura! B\u0103i, care-l crede\u021bi pe sonatul \u0103sta, ave\u021bi \u0219i voi nevoie de ni\u0219te pastile, ceva. Revenim la Alexandreasca \u0219i declara\u021biile ei minunate de fals \u00een acte publice \u0219i averi. Apartamentul din Corbeanca \u00eel vinde \u00een 2013. Cui \u00eel vinde? Unei colege de la Prim\u0103ria Bucure\u0219tiului. S\u0103 vede\u021bi minune de minune. Ei bine, exact, exact \u00een acela\u0219i an c\u00e2nd Alexandreasca, m\u00e2na dreapt\u0103 a lui Oprescu, intr\u0103 \u00een guvernul USL, doamna Natali devine directoarea de cabinet a consilierului de stat Anca Alexandrescu \u0219i este rapid numit\u0103 \u00eentr-un consiliu de administra\u021bie. Desigur, v\u00e2nzarea casei a fost cinstit\u0103, Doamne fere\u0219te. Nu e singura v\u00e2nzare puturoas\u0103 pe care o face doamna Alexandrescu. \u00cen declara\u021bia din 2016 apare v\u00e2nzarea de mai jos c\u0103tre Pink Foods International SRL. Aproape 9 ha. Pink Foods era controlat\u0103 de un cet\u0103\u021bean turc, cu afaceri de mare succes cu statul prin privatiz\u0103rile alea cele mai nenorocite \u0219i corupte. Mai clar, Alexandreasca, mare suveranist\u0103, cea care e cu glia, cu poporul, cu Dumnezeu, a v\u00e2ndut pentru 80000 \u20ac \u0219i un Touareg o ditamai bucat\u0103 din p\u0103m\u00e2ntul str\u0103mo\u0219esc unui turc care apare \u00een scandalul privatiz\u0103rilor foarte dubioase din timpul PSD-ului, c\u00e2nd Alexandreasca era at\u00e2t de iubit\u0103 de \u0219eful de pe-atunci al corup\u021biilor social-democra\u021bilor, Adrian N\u0103stase. \u0218i hai s\u0103 v\u0103 mai ar\u0103t\u0103m un lucru. \u00cen 2013, conform declara\u021biei de avere, doamna Alexandrescu \u00eemprumut\u0103 o persoan\u0103 fizic\u0103 cu 60000 \u20ac. Asta de\u0219i femeia avea datorii de peste 250000 \u20ac \u00een b\u0103nci \u0219i tr\u0103ia \u00eentr-o debara de 4,12 m\u00b2. Nu are rost s\u0103 insist\u0103m pe minciunile din documentele publice ale doamnei Alexandrescu. Declara\u021biile ei de avere sunt, a\u0219a cum v-am spus, ni\u0219te mizerii. S-ar putea spune c\u0103 Alexandreasca e o parlagladin\u0103, o oportunist\u0103 agresiv\u0103, care a fost prima la banii statului oric\u00e2nd a putut. \u00cen definitiv, PSD-ul punea pe mii de euro \u00een tot felul de sinecuri pe care prea cinstit\u0103 vedet\u0103 de la Realitatea TV nu \u0219i le trecea \u00een declara\u021bia de avere, a\u0219a cum ar fi fost obligatoriu. \u0218mechere\u0219te, trecea \u00een declara\u021biile de interese veniturile pe lun\u0103, f\u0103r\u0103 \u00eens\u0103 a scrie c\u0103 ele sunt pe lun\u0103, ca s\u0103 par\u0103 mai pu\u021bin. Cum am explicat, legal era s\u0103 treac\u0103 toate c\u00e2\u0219tigurile anuale \u00een declara\u021bia de avere. Alexandreasca este, \u00een concluzie, \u0219i o specialist\u0103 \u00een \u0219arlatanie. A avut sinecuri la Romarm, chestia aia controlat\u0103 de servicii, treaba aia care e de importan\u021b\u0103 strategic\u0103 pentru stat, cu calificarea absolut zero. La Fondul de Contragarantare, o chestie pentru care iar\u0103\u0219i, iar\u0103\u0219i avea calific\u0103ri zero zero. La Romaero, acolo probabil avea calific\u0103ri de avion, c\u0103 altfel nu se explic\u0103 \u0219i la IOR, alt\u0103 chestie care produce echipament militar pentru care avea calificare zero. Sau, s-ar putea, a\u0219a cum spune spionul Neme\u021bi, s\u0103 fie \u00eenc\u0103 un jurnalist acoperit \u0219i atunci brusc numirile astea ar avea cumva sens. Alexandreasca a fost trompeta lui Iliescu, N\u0103stase, Oprescu, Dragnea, a\u0219a cum a pu\u0219c\u0103ria\u0219ului patron de la Realitatea TV \u0219i a lui Gu\u0219\u0103, fost secretar general al PSD \u0219i amic cu cei mai stino\u0219i dintre pesedi\u0219ti. Alexandreasca se \u00eembog\u0103\u021be\u0219te din v\u00e2nzare de minciuni \u0219i vr\u0103jeli pentru fraieri \u0219i asta a f\u0103cut toat\u0103 via\u021ba ei. Nimic pentru nimeni, doar pentru ea. Alexandreasca e remarcabil\u0103 \u0219i prin oportunismul ei \u0219i lipsa absolut\u0103, ca s\u0103 folosesc cuv\u00e2ntul favorit al gurului Georgescu, de coloan\u0103 vertebral\u0103. Hai, sictir, bre!\n", "type": "Document"}}